{
  "schema_version": "0.2.1",
  "tenant_id": "synthetic-tenant-a",
  "decision_id": "synthetic-decision-001",
  "subject_id": "synthetic-subject-001",
  "opportunity_id": "synthetic-role-001",
  "evidence_assessments": [],
  "gates": [
    {
      "gate_code": "NO_ACTION_AUTHORITY",
      "gate_class": "action_authority",
      "result": "unknown",
      "rule_version": "foundation-unimplemented",
      "explanation": "Fixture only; action evaluation not implemented."
    }
  ],
  "next_action": {
    "action_code": "review_evidence",
    "authority_result": "blocked",
    "explanation": "No external action implementation."
  },
  "versions": {
    "policy_pack": "unimplemented",
    "decision_policy": "unimplemented",
    "schema": "0.2.1"
  },
  "created_at": "2026-09-13T00:00:00Z"
}
